{
  "schema_version": "P1008_DERIVED_KPI_CANDIDATE_V1",
  "candidate_id": "TEST-ONLY-PB-2026-09-18-V1",
  "synthetic_fixture": true,
  "metric_id": "TEST_PB_MULTIPLE",
  "metric_name": "Synthetic price-to-book multiple",
  "dimension": "VALUATION",
  "period": "2026-09-18",
  "as_of_date": "2026-09-18",
  "value": "2.000",
  "unit": "MULTIPLE",
  "data_tier": "T1_EXACT_DERIVED",
  "derivation_method": "EXACT_DETERMINISTIC",
  "formula_id": "P1008_PB_PRICE_DIV_BVPS",
  "formula_version": "EXISTING_DAILY_PRICE_MANIFEST_V1",
  "formula_expression": "TEST_CLOSE_TWD / TEST_BVPS_TWD",
  "input_metric_ids": ["TEST_CLOSE_TWD", "TEST_BVPS_TWD"],
  "input_values": ["200.000", "100.000"],
  "input_units": ["TWD_PER_SHARE", "TWD_PER_SHARE"],
  "input_periods": ["2026-09-18", "2026-09-18"],
  "input_source_ids": ["TEST-OFFICIAL-CLOSE", "TEST-GOVERNED-BVPS"],
  "input_source_tiers": ["T0_DIRECT_OFFICIAL", "T0_DIRECT_OFFICIAL"],
  "input_source_locators": ["TEST_ONLY://close", "TEST_ONLY://bvps"],
  "input_hashes": [
    "E02C5F911B381D99EB6778F8898E92CAD5E0213D496F3DF446857DA0444BE85E",
    "3BD898E967DB8553C6EF1B4BD1B5A2ECC33A37FFC020351F99306E3A006AD41A"
  ],
  "input_semantic_names": ["CLOSING_PRICE_PER_SHARE", "BOOK_VALUE_PER_SHARE"],
  "input_governed": [true, true],
  "denominator_definition": "TEST_BVPS_TWD: same-period governed book value per share in TWD per share",
  "period_alignment_rule": "ALL_INPUT_PERIODS_EQUAL_CANDIDATE_PERIOD",
  "unit_conversion_rule": "DIVIDE_SAME_UNITS_TO_MULTIPLE_NO_CONVERSION",
  "rounding_rule": "DECIMAL_HALF_UP_3DP",
  "assumptions": [],
  "assumption_count": 0,
  "sensitivity_range": null,
  "derivation_trace": [
    "TEST_ONLY fixture; no real-world value is asserted.",
    "Bind the two synthetic input records and their hashes.",
    "Divide 200.000 TWD/share by 100.000 TWD/share.",
    "Round half up to three decimal places to reproduce 2.000."
  ],
  "recomputation": {
    "operator": "DIVIDE",
    "left_input_metric_id": "TEST_CLOSE_TWD",
    "right_input_metric_id": "TEST_BVPS_TWD",
    "multiplier": "1"
  },
  "semantic_name": "PRICE_TO_BOOK_MULTIPLE",
  "semantic_match_status": "EXACT_MATCH",
  "proxy_metric_used": false,
  "proxy_relabelled_as_direct": false,
  "confidence": "HIGH",
  "validation_status": "VALIDATED_CANDIDATE",
  "candidate_status": "OWNER_REVIEW_REQUIRED",
  "owner_review_required": true,
  "owner_authorization_reference": null,
  "actionable": false,
  "publication": false,
  "production_scoring_enabled": false
}
