{
  "schema_version": "P1008_DERIVED_KPI_CANDIDATE_V1",
  "candidate_id": "TEST-ONLY-T2-PB-2026-09-18-V1",
  "synthetic_fixture": true,
  "metric_id": "TEST_ESTIMATED_PB_MULTIPLE",
  "metric_name": "Synthetic estimated price-to-book multiple",
  "dimension": "VALUATION",
  "period": "2026-09-18",
  "as_of_date": "2026-09-18",
  "value": "1.905",
  "unit": "MULTIPLE",
  "data_tier": "T2_ESTIMATED_DERIVED",
  "derivation_method": "ESTIMATED_WITH_DECLARED_ASSUMPTIONS",
  "formula_id": "P1008_TEST_ESTIMATED_PB_PRICE_DIV_BVPS",
  "formula_version": "TEST_ONLY_V1",
  "formula_expression": "TEST_CLOSE_TWD / TEST_ESTIMATED_BVPS_TWD",
  "input_metric_ids": ["TEST_CLOSE_TWD", "TEST_ESTIMATED_BVPS_TWD"],
  "input_values": ["200.000", "105.000"],
  "input_units": ["TWD_PER_SHARE", "TWD_PER_SHARE"],
  "input_periods": ["2026-09-18", "2026-09-18"],
  "input_source_ids": ["TEST-OFFICIAL-CLOSE", "TEST-ESTIMATED-BVPS"],
  "input_source_tiers": ["T0_DIRECT_OFFICIAL", "T2_ESTIMATED_DERIVED"],
  "input_source_locators": ["TEST_ONLY://close", "TEST_ONLY://estimated-bvps"],
  "input_hashes": [
    "E02C5F911B381D99EB6778F8898E92CAD5E0213D496F3DF446857DA0444BE85E",
    "C2AE94D195EDE198AC4EEB7A86FF29D0E9E688FA8323E402607993328AB2A10C"
  ],
  "input_semantic_names": ["CLOSING_PRICE_PER_SHARE", "ESTIMATED_BOOK_VALUE_PER_SHARE"],
  "input_governed": [true, true],
  "denominator_definition": "TEST_ESTIMATED_BVPS_TWD: same-period estimated book value per share in TWD per share",
  "period_alignment_rule": "ALL_INPUT_PERIODS_EQUAL_CANDIDATE_PERIOD",
  "unit_conversion_rule": "DIVIDE_SAME_UNITS_TO_MULTIPLE_NO_CONVERSION",
  "rounding_rule": "DECIMAL_HALF_UP_3DP",
  "assumptions": ["TEST_ONLY estimated BVPS is used solely to exercise the T2 contract."],
  "assumption_count": 1,
  "sensitivity_range": {
    "low": "1.800",
    "high": "2.050",
    "unit": "MULTIPLE",
    "method": "TEST_ONLY_BVPS_RANGE_RECALCULATION_V1"
  },
  "derivation_trace": [
    "TEST_ONLY fixture; no real-world value is asserted.",
    "Bind the synthetic official close and estimated BVPS with their source hashes.",
    "Divide 200.000 TWD/share by the estimated 105.000 TWD/share denominator.",
    "Round half up to three decimal places and retain the declared uncertainty range."
  ],
  "recomputation": {
    "operator": "DIVIDE",
    "left_input_metric_id": "TEST_CLOSE_TWD",
    "right_input_metric_id": "TEST_ESTIMATED_BVPS_TWD",
    "multiplier": "1"
  },
  "semantic_name": "PRICE_TO_BOOK_MULTIPLE",
  "semantic_match_status": "EXACT_MATCH",
  "proxy_metric_used": false,
  "proxy_relabelled_as_direct": false,
  "confidence": "MEDIUM",
  "validation_status": "VALIDATED_CANDIDATE",
  "candidate_status": "OWNER_REVIEW_REQUIRED",
  "owner_review_required": true,
  "owner_authorization_reference": null,
  "actionable": false,
  "publication": false,
  "production_scoring_enabled": false
}
